<?xml version="1.0" encoding="ISO-8859-1"?>
<ticket codigo="t00037" xmlns:xs="http://www.w3.org/2001/XMLSchema-instance" xs:noNamespaceSchemaLocation="Pruebarepasoxsd.xsd">
<datos_ticket>
  <fecha_hora>1998-07-12T16:30:00.000</fecha_hora>
	<precio_total moneda="euro">
		<cantidad_sin_iva>1</cantidad_sin_iva>
		<cantidad_iva>1</cantidad_iva>
		<pvp_total>1</pvp_total>
	</precio_total>
	<forma_pago numero="************1234" tipo="Visa Clasica">
	Tarjeta
	</forma_pago>
	<cliente>Pedro Medario</cliente>
</datos_ticket>
<datos_comercio>
	<nombre></nombre>
	<direccion></direccion>
	<cif></cif>
	<telefono>1</telefono>
</datos_comercio>
<datos_compra>
	<lineas_compra>
		<nombre_articulo></nombre_articulo>
		<cantidad>1</cantidad>
		<precio_unitario>1</precio_unitario>
		<iva>1</iva>
		<pvp>1</pvp>
	</lineas_compra>
</datos_compra>
</ticket>